{
    "$schema": "http://json-schema.org/draft-06/schema#",
    "$ref": "#/definitions/MangaItem",
    "definitions": {
        "MangaItem": {
            "type": "object",
            "additionalProperties": false,
            "properties": {
                "id": {
                    "type": "string",
                    "pattern": "^(https://twitter\\.com/noreal_koma/status/\\d+|https://www\\.instagram\\.com/p/[^/]+/)$"
                },
                "publishDate": {
                    "type": "string",
                    "format": "date-time"
                },
                "text": {
                    "type": "array",
                    "items": {
                        "type": "string"
                    }
                },
                "reading": {
                    "type": "array",
                    "items": {
                        "type": "string",
                        "pattern": "^[ぁ-ゖー]*$"
                    }
                },
                "tag": {
                    "type": "array",
                    "items": {
                        "type": "string"
                    }
                },
                "series": {
                    "type": "array",
                    "items": {
                        "type": "string"
                    }
                },
                "characters": {
                    "type": "array",
                    "items": {
                        "type": "string"
                    }
                },
                "suzuri": {
                    "type": "array",
                    "items": {
                        "$ref": "#/definitions/LinkItemSuzuri"
                    }
                },
                "lineSticker": {
                    "type": "array",
                    "items": {
                        "$ref": "#/definitions/LinkItemLineSticker"
                    }
                },
                "instagram": {
                    "type": "array",
                    "items": {
                        "$ref": "#/definitions/LinkItemInstagram"
                    }
                },
                "QRCode": {
                    "type": "array",
                    "items": {
                        "$ref": "#/definitions/LinkItem"
                    }
                }
            },
            "required": [
                "id",
                "publishDate",
                "reading",
                "text",
                "tag",
                "series",
                "characters",
                "suzuri",
                "lineSticker",
                "instagram",
                "QRCode"
            ],
            "title": "MangaItem"
        },
        "LinkItem": {
            "type": "object",
            "additionalProperties": false,
            "properties": {
                "title": {
                    "type": "string"
                },
                "url": {
                    "type": "string",
                    "pattern": "^https://"
                }
            },
            "required": [
                "title",
                "url"
            ],
            "title": "LinkItem"
        },
        "LinkItemSuzuri": {
            "type": "object",
            "additionalProperties": false,
            "properties": {
                "title": {
                    "type": "string"
                },
                "url": {
                    "type": "string",
                    "pattern": "^https://suzuri\\.jp/noreal_koma/designs/\\d+$"
                }
            },
            "required": [
                "title",
                "url"
            ],
            "title": "LinkItemSuzuri"
        },
        "LinkItemLineSticker": {
            "type": "object",
            "additionalProperties": false,
            "properties": {
                "title": {
                    "type": "string"
                },
                "url": {
                    "type": "string",
                    "pattern": "^https://store\\.line\\.me/stickershop/product/\\d+/ja$"
                }
            },
            "required": [
                "title",
                "url"
            ],
            "title": "LinkItemLineSticker"
        },
        "LinkItemInstagram": {
            "type": "object",
            "additionalProperties": false,
            "properties": {
                "title": {
                    "type": "string"
                },
                "url": {
                    "type": "string",
                    "pattern": "^https://www\\.instagram\\.com/noreal_koma/p/[^/]+/$"
                }
            },
            "required": [
                "title",
                "url"
            ],
            "title": "LinkItemInstagram"
        }
    }
}
