{
    "id": "https://twitter.com/noreal_koma/status/1904843773315514621",
    "publishDate": "2025-03-26T10:32:00+00:00",
    "text": [
        "井伊直弼どこ!?",
        "はやく誅殺しないとヤバいよ!!"
    ],
    "reading": [
        "いいなおすけどこ",
        "はやくちゅうさつしないとやばいよ"
    ],
    "tag": [
        "VR",
        "ゴーグル"
    ],
    "series": [],
    "characters": [],
    "suzuri": [
        {
            "title": "存在しない漫画の１コマ（女）",
            "url": "https://suzuri.jp/noreal_koma/designs/17480798"
        }
    ],
    "lineSticker": [],
    "instagram": [
        {
            "title": "Instagram",
            "url": "https://www.instagram.com/noreal_koma/p/DHqS_ZAySMX/"
        }
    ],
    "QRCode": []
}
