{
    "id": "https://twitter.com/noreal_koma/status/1835265302076035368",
    "publishDate": "2024-09-15T10:32:00+00:00",
    "text": [
        "頼む!!バズってくれ!!",
        "バズれーーっ!!バズれーーっ!!"
    ],
    "reading": [
        "たのむばずってくれ",
        "ばずれーーっばずれーーっ"
    ],
    "tag": [
        "スマートフォン",
        "銃",
        "SNS",
        "裸"
    ],
    "series": [],
    "characters": [],
    "suzuri": [],
    "lineSticker": [],
    "instagram": [
        {
            "title": "Instagram",
            "url": "https://www.instagram.com/noreal_koma/p/DEqy4_dSM9X/"
        }
    ],
    "QRCode": []
}
