{
    "id": "https://twitter.com/noreal_koma/status/1956302850130137516",
    "publishDate": "2025-08-15T10:32:00+00:00",
    "text": [
        "……？",
        "僕何か嫌われることした？",
        "いてて…",
        "……昨日あの子の両親殺したでしょ"
    ],
    "reading": [
        "",
        "ぼくなにかきらわれることした",
        "いてて",
        "きのうあのこのりょうしんころしたでしょ"
    ],
    "tag": [
        "片目隠れ",
        "髪留め",
        "ぱっつん",
        "マント"
    ],
    "series": [],
    "characters": [],
    "suzuri": [],
    "lineSticker": [],
    "instagram": [],
    "QRCode": []
}
