{
    "id": "https://twitter.com/noreal_koma/status/1875852743375466861",
    "publishDate": "2025-01-05T10:32:00+00:00",
    "text": [
        "2人ともご飯できたわよ～",
        "はーい"
    ],
    "reading": [
        "ふたりともごはんできたわよー",
        "はーい"
    ],
    "tag": [
        "障子"
    ],
    "series": [],
    "characters": [],
    "suzuri": [],
    "lineSticker": [],
    "instagram": [],
    "QRCode": []
}
