{
    "id": "https://twitter.com/noreal_koma/status/1850123205178249216",
    "publishDate": "2024-10-26T10:32:00+00:00",
    "text": [
        "うっわ最悪…",
        "なんで私がアンタのを処理しなきゃいけないのよ…",
        "誰がシーツ取ってきてー",
        "最悪なのはこっちよ!!"
    ],
    "reading": [
        "うっわさいあく",
        "なんでわたしがあんたのをしょりしなきゃいけないのよ",
        "だれがしーつとってきてー",
        "さいあくなのはこっちよ"
    ],
    "tag": [
        "ミニキャラ",
        "吹き出しに顔"
    ],
    "series": [],
    "characters": [],
    "suzuri": [],
    "lineSticker": [],
    "instagram": [],
    "QRCode": []
}
