{
    "id": "https://twitter.com/noreal_koma/status/1955940462654640270",
    "publishDate": "2025-08-14T10:32:00+00:00",
    "text": [
        "何せこの俺がこの漫画の主人公だからな！",
        "都まひの…本作の主人公で、群馬女子美術大学一年 ハン・ファン・メーヘレンを崇拝してい"
    ],
    "reading": [
        "なんせこのおれがこのまんがのしゅじんこうだからな",
        "みやこまひのほんさくのしゅじんこうでぐんまじょしびじゅつだいがくいちねんはんふぁんめーへれんをすうはいしてい"
    ],
    "tag": [
        "モヒカン",
        "ヒゲ",
        "ピアス",
        "バーコード"
    ],
    "series": [],
    "characters": [],
    "suzuri": [],
    "lineSticker": [],
    "instagram": [],
    "QRCode": []
}
