{
    "id": "https://twitter.com/noreal_koma/status/1950142256138326407",
    "publishDate": "2025-07-29T10:32:00+00:00",
    "text": [
        "ははっ いいぞいいぞ",
        "どんどん伸びろ～！"
    ],
    "reading": [
        "ははっいいぞいいぞ",
        "どんどんのびろー"
    ],
    "tag": [
        "鎖",
        "褐色肌",
        "巨乳"
    ],
    "series": [],
    "characters": [],
    "suzuri": [],
    "lineSticker": [],
    "instagram": [],
    "QRCode": []
}
