{
    "id": "https://twitter.com/noreal_koma/status/1946155990178746669",
    "publishDate": "2025-07-18T10:32:00+00:00",
    "text": [
        "生きて帰れるんだ!!"
    ],
    "reading": [
        "いきてかえれるんだ"
    ],
    "tag": [
        "体操服",
        "死亡フラグ",
        "巨乳"
    ],
    "series": [],
    "characters": [],
    "suzuri": [],
    "lineSticker": [
        {
            "title": "存在しない漫画のLINEスタンプ 第３弾",
            "url": "https://store.line.me/stickershop/product/31412619/ja"
        }
    ],
    "instagram": [],
    "QRCode": []
}
