{
    "id": "https://twitter.com/noreal_koma/status/1945793602288046137",
    "publishDate": "2025-07-17T10:32:00+00:00",
    "text": [
        "続いて3回戦第2試合は――",
        "因縁(?)の対決だァッ!!",
        "龍子(ロンコ) VS ニセ龍子(ロンコ)"
    ],
    "reading": [
        "つづいてさんかいせんだいにしあいは",
        "いんねんのたいけつだぁっ",
        "ろんこばーさすにせろんこ"
    ],
    "tag": [
        "巨乳",
        "ヒゲ"
    ],
    "series": [],
    "characters": [],
    "suzuri": [],
    "lineSticker": [],
    "instagram": [],
    "QRCode": []
}
