{
    "id": "https://twitter.com/noreal_koma/status/1897958403429020100",
    "publishDate": "2025-03-07T10:32:00+00:00",
    "text": [
        "瘡蓋の中の体毛のように",
        "人知れず成長していたのさ",
        "フー…"
    ],
    "reading": [
        "かさぶたのなかのたいもうのように",
        "ひとしれずせいちょうしていたのさ",
        "ふー"
    ],
    "tag": [
        "スポーツ"
    ],
    "series": [],
    "characters": [],
    "suzuri": [
        {
            "title": "存在しない漫画の１コマ（男）",
            "url": "https://suzuri.jp/noreal_koma/designs/17480388"
        }
    ],
    "lineSticker": [],
    "instagram": [],
    "QRCode": []
}
