{
    "id": "https://twitter.com/noreal_koma/status/1894034115717931194",
    "publishDate": "2025-02-24T14:38:17+00:00",
    "text": [
        "黒々漆子…15年間地下で飲まず食わずだったので食べ物に興味津々。",
        "吹鴫ナユ太…普通の家庭で育った高校 寝相がめちゃくちゃ悪い"
    ],
    "reading": [
        "くろぐろうるこじゅうごねんかんちかでのまずくわすだったのでたべものにきょうみしんしん",
        "ふかしぎなゆたふつうのかていでそだったこうこうねそうがめちゃくちゃわるい"
    ],
    "tag": [
        "雑誌",
        "柱",
        "登場人物紹介"
    ],
    "series": [
        "黒々さん"
    ],
    "characters": [
        "黒々漆子",
        "吹鴫ナユ太"
    ],
    "suzuri": [],
    "lineSticker": [],
    "instagram": [],
    "QRCode": []
}
