{
    "id": "https://twitter.com/noreal_koma/status/1936733905471865015",
    "publishDate": "2025-06-22T10:32:00+00:00",
    "text": [
        "スリ対策用のダミー財布ですわ!!",
        "6000€だけ入れてますの!!",
        "※約100万円",
        "……もうなんでもアリねアンタ"
    ],
    "reading": [
        "すりたいさくようのだみーさいふですわ",
        "ろくせんゆーろだけいれてますの",
        "やくひゃくまんえん",
        "もうなんでもありねあんた"
    ],
    "tag": [
        "ミニキャラ",
        "お嬢様",
        "モン・サン＝ミシェル",
        "フランス"
    ],
    "series": [],
    "characters": [],
    "suzuri": [],
    "lineSticker": [],
    "instagram": [],
    "QRCode": []
}
