{
    "id": "https://twitter.com/noreal_koma/status/1921151226713972928",
    "publishDate": "2025-05-10T10:32:00+00:00",
    "text": [
        "同じく幹部の仲間愛",
        "自らの邪魔になれば仲間すら平気で切り捨てるクズだ",
        "仲間様ー!!",
        "愛さまー♥"
    ],
    "reading": [
        "おなじくかんぶのなかまあい",
        "みずからのじゃまになればなかますらへいきできりすてるくずだ",
        "なかまさま",
        "あいさま"
    ],
    "tag": [
        "巨乳",
        "ホクロ",
        "タートルネック",
        "ノースリーブ"
    ],
    "series": [],
    "characters": [],
    "suzuri": [],
    "lineSticker": [],
    "instagram": [],
    "QRCode": []
}
