{
    "id": "https://twitter.com/noreal_koma/status/1908830039023538207",
    "publishDate": "2025-04-06T10:32:00+00:00",
    "text": [
        "更衣室に仕掛けた超小型カメラは82台……",
        "これなら一度の着替えで男子生徒全員のチンポが見れる!!"
    ],
    "reading": [
        "こういしつにしかけたちょうこがたかめらはだい",
        "これならいちどのきがえでだんしせいとぜんいんのちんぽがみれる"
    ],
    "tag": [
        "変態",
        "盗撮",
        "犯罪者",
        "下ネタ",
        "チンポ",
        "モザイク"
    ],
    "series": [],
    "characters": [],
    "suzuri": [],
    "lineSticker": [],
    "instagram": [],
    "QRCode": []
}
