{
    "id": "https://twitter.com/noreal_koma/status/1829883240196554849",
    "publishDate": "2024-08-31T14:05:36+00:00",
    "text": [],
    "reading": [],
    "tag": [
        "制服",
        "セーラー服"
    ],
    "series": [
        "黒々さん"
    ],
    "characters": [
        "黒々漆子"
    ],
    "suzuri": [],
    "lineSticker": [],
    "instagram": [],
    "QRCode": []
}
