{
    "id": "https://twitter.com/noreal_koma/status/1858820513772290093",
    "publishDate": "2024-11-19T10:32:00+00:00",
    "text": [
        "出やがったな……!!",
        "偉業の生命体!!"
    ],
    "reading": [
        "でやがったな",
        "いぎょうのせいめいたい"
    ],
    "tag": [
        "武器",
        "単行本修正",
        "傷跡"
    ],
    "series": [],
    "characters": [],
    "suzuri": [
        {
            "title": "存在しない漫画の１コマ（男）",
            "url": "https://suzuri.jp/noreal_koma/designs/17480388"
        }
    ],
    "lineSticker": [],
    "instagram": [],
    "QRCode": []
}
