{
    "id": "https://www.instagram.com/p/DJwCixwSaDb/",
    "publishDate": "2025-05-17T10:03:01+00:00",
    "text": [
        "こうなったらフォロワーさんに訊いちゃうもんね♪",
        "えーっと……「オススメのオスターピンツェン専門店教えてください」…っと♪"
    ],
    "reading": [
        "こうなったらふぉろわーさんにきいちゃうもんね",
        "えーっとおすすめのおすたーぴんつぇんせんもんてんおしえてくださいっと"
    ],
    "tag": [
        "髪留め",
        "スマートフォン",
        "パジャマ",
        "SNS"
    ],
    "series": [],
    "characters": [],
    "suzuri": [],
    "lineSticker": [],
    "instagram": [],
    "QRCode": []
}
