{
    "id": "https://twitter.com/noreal_koma/status/1947605541062365556",
    "publishDate": "2025-07-22T10:32:00+00:00",
    "text": [
        "俺はあの時……奴に復讐を誓ったんだ…!!",
        "時は遡り……",
        "弥生時代"
    ],
    "reading": [
        "おれはあのときやつにふくしゅうをちかったんだ",
        "ときはさかのぼり",
        "やよいじだい"
    ],
    "tag": [
        "ホクロ",
        "フード"
    ],
    "series": [],
    "characters": [],
    "suzuri": [],
    "lineSticker": [],
    "instagram": [],
    "QRCode": []
}
