{
    "id": "https://twitter.com/noreal_koma/status/1942894498838634516",
    "publishDate": "2025-07-09T10:32:00+00:00",
    "text": [
        "一日中こっくりさんのことを考えて過ごしてる所謂〝こっくりバカ〟だ",
        "元素の周期表を改造してこっくりボードにできないかな……",
        "な？"
    ],
    "reading": [
        "いちにちじゅうこっくりさんのことをかんがえてすごしてるいわゆるこっくりばかだ",
        "げんそのしゅうきひょうをかいぞうしてこっくりぼーどにできないかな",
        "な"
    ],
    "tag": [
        "制服",
        "セーラー服",
        "巨乳",
        "髪留め",
        "コックリさん"
    ],
    "series": [],
    "characters": [
        "倉三沢あかね"
    ],
    "suzuri": [
        {
            "title": "こっくり部副部長　倉三沢あかね",
            "url": "https://suzuri.jp/noreal_koma/designs/18351229"
        }
    ],
    "lineSticker": [],
    "instagram": [],
    "QRCode": []
}
