{
    "id": "https://twitter.com/noreal_koma/status/1891797809478893628",
    "publishDate": "2025-02-18T10:32:00+00:00",
    "text": [
        "ありがとうコン子ちゃん！",
        "儂の術……ゴホン 手品にかかればこんなものじゃ！"
    ],
    "reading": [
        "ありがとうこんこちゃん",
        "わしのじゅつごほんてじなにかかればこんなものじゃ"
    ],
    "tag": [
        "巨乳",
        "ふともも",
        "名札"
    ],
    "series": [
        "コンイチ"
    ],
    "characters": [
        "狐鳴紺子郎"
    ],
    "suzuri": [],
    "lineSticker": [],
    "instagram": [
        {
            "title": "Instagram",
            "url": "https://www.instagram.com/noreal_koma/p/DGQJPMySoPX/"
        }
    ],
    "QRCode": []
}
