{
    "id": "https://twitter.com/noreal_koma/status/1861719617108050256",
    "publishDate": "2024-11-27T10:32:00+00:00",
    "text": [
        "手を動かす暇があったら口を動かせ",
        "ヒイ……ッ"
    ],
    "reading": [
        "てをうごかすひまがあったらくちをうごかせ",
        "ひいっ"
    ],
    "tag": [
        "雄っぱい",
        "筋肉"
    ],
    "series": [],
    "characters": [],
    "suzuri": [],
    "lineSticker": [],
    "instagram": [],
    "QRCode": []
}
