{
    "id": "https://twitter.com/noreal_koma/status/1942169722960961927",
    "publishDate": "2025-07-07T10:32:00+00:00",
    "text": [
        "それは流石に家庭環境のせいにしていいと思う。"
    ],
    "reading": [
        "それはさすがにかていかんきょうのせいにしていいとおもう"
    ],
    "tag": [
        "天使",
        "羽",
        "リボン"
    ],
    "series": [],
    "characters": [],
    "suzuri": [],
    "lineSticker": [],
    "instagram": [],
    "QRCode": []
}
