{
    "id": "https://twitter.com/noreal_koma/status/1955215686331994553",
    "publishDate": "2025-08-12T10:32:00+00:00",
    "text": [
        "落ち着いてお並びください！",
        "慌てなくてもブレステ5は逃げませんから！",
        "BS5"
    ],
    "reading": [
        "おちついておならびください",
        "あわてなくてもぶれすてふぁいぶはにげませんから",
        "びーえすふぁいぶ"
    ],
    "tag": [
        "プレステ5",
        "店員",
        "ヒゲ"
    ],
    "series": [],
    "characters": [],
    "suzuri": [],
    "lineSticker": [],
    "instagram": [],
    "QRCode": []
}
