{
    "id": "https://twitter.com/noreal_koma/status/1951591807378485325",
    "publishDate": "2025-08-02T10:32:00+00:00",
    "text": [
        "お寿司食べていいよ",
        "は？",
        "それおにぎりね"
    ],
    "reading": [
        "おすしたべていいよ",
        "は",
        "それおにぎりね"
    ],
    "tag": [
        "制服",
        "セーラー服",
        "学ラン",
        "おにぎり",
        "ミニキャラ",
        "吹き出しに顔"
    ],
    "series": [
        "黒々さん"
    ],
    "characters": [
        "黒々漆子",
        "吹鴫ナユ太",
        "星見鳥心"
    ],
    "suzuri": [],
    "lineSticker": [
        {
            "title": "存在しない漫画のLINEスタンプ 第３弾",
            "url": "https://store.line.me/stickershop/product/31412619/ja"
        }
    ],
    "instagram": [],
    "QRCode": []
}
